source,author,title,description,url,urlToImage,publishedAt,content
"{'id': None, 'name': 'Biztoc.com'}",thestreet.com,Something's gotta give in this summer's whackadoodle market,"The stock market looks great overall, maybe too great. 
Thanks to frenzied investors who crave all things tech, the S&P 500, the Nasdaq Composite and the Nasdaq-100 indexes all closed the week at record highs. 
Apple (AAPL) , Amazon.com (AMZN) , Google parent…",https://biztoc.com/x/de70ddaa56e55f8e,https://biztoc.com/cdn/de70ddaa56e55f8e_s.webp,2024-07-07T03:02:11Z,"The stock market looks great overall, maybe too great. Thanks to frenzied investors who crave all things tech, the S&amp;P 500, the Nasdaq Composite and the Nasdaq-100 indexes all closed the week at … [+140 chars]"
"{'id': None, 'name': 'ETF Daily News'}",MarketBeat News,Alphabet Inc. (NASDAQ:GOOGL) is Troy Asset Management Ltd’s 3rd Largest Position,"Troy Asset Management Ltd increased its stake in Alphabet Inc. (NASDAQ:GOOGL – Free Report) by 2.6% in the first quarter, according to its most recent 13F filing with the Securities & Exchange Commission. The institutional investor owned 2,022,957 shares of t…",https://www.etfdailynews.com/2024/07/06/alphabet-inc-nasdaqgoogl-is-troy-asset-management-ltds-3rd-largest-position/,https://www.americanbankingnews.com/wp-content/timthumb/timthumb.php?src=https://www.marketbeat.com/logos/google-inc-logo-1200x675.png&w=240&h=240&zc=2,2024-07-06T14:08:42Z,"Troy Asset Management Ltd increased its stake in Alphabet Inc. (NASDAQ:GOOGL – Free Report) by 2.6% in the first quarter, according to its most recent 13F filing with the Securities &amp; Exchange Co… [+6753 chars]"
"{'id': None, 'name': 'ETF Daily News'}",MarketBeat News,Naples Global Advisors LLC Decreases Stake in Alphabet Inc. (NASDAQ:GOOGL),"Naples Global Advisors LLC reduced its stake in shares of Alphabet Inc. (NASDAQ:GOOGL – Free Report) by 3.7% during the 1st quarter, according to its most recent 13F filing with the SEC. The institutional investor owned 17,307 shares of the information servic…",https://www.etfdailynews.com/2024/07/06/naples-global-advisors-llc-decreases-stake-in-alphabet-inc-nasdaqgoogl/,https://www.americanbankingnews.com/wp-content/timthumb/timthumb.php?src=https://www.marketbeat.com/logos/google-inc-logo-1200x675.png&w=240&h=240&zc=2,2024-07-06T14:08:41Z,"Naples Global Advisors LLC reduced its stake in shares of Alphabet Inc. (NASDAQ:GOOGL – Free Report) by 3.7% during the 1st quarter, according to its most recent 13F filing with the SEC. The institut… [+6851 chars]"
"{'id': None, 'name': 'ETF Daily News'}",MarketBeat News,Alphabet Inc. (NASDAQ:GOOGL) Shares Acquired by OFI Invest Asset Management,"OFI Invest Asset Management raised its stake in shares of Alphabet Inc. (NASDAQ:GOOGL – Free Report) by 12.0% during the first quarter, HoldingsChannel reports. The fund owned 1,186,114 shares of the information services provider’s stock after acquiring an ad…",https://www.etfdailynews.com/2024/07/06/alphabet-inc-nasdaqgoogl-shares-acquired-by-ofi-invest-asset-management/,https://www.americanbankingnews.com/wp-content/timthumb/timthumb.php?src=https://www.marketbeat.com/logos/google-inc-logo-1200x675.png&w=240&h=240&zc=2,2024-07-06T14:08:41Z,"OFI Invest Asset Management raised its stake in shares of Alphabet Inc. (NASDAQ:GOOGL – Free Report) by 12.0% during the first quarter, HoldingsChannel reports. The fund owned 1,186,114 shares of the… [+6956 chars]"
"{'id': None, 'name': 'ETF Daily News'}",MarketBeat News,Unionview LLC Lowers Stock Holdings in Alphabet Inc. (NASDAQ:GOOGL),"Unionview LLC lowered its holdings in shares of Alphabet Inc. (NASDAQ:GOOGL – Free Report) by 1.3% during the first quarter, according to its most recent disclosure with the Securities and Exchange Commission. The institutional investor owned 5,272 shares of …",https://www.etfdailynews.com/2024/07/06/unionview-llc-lowers-stock-holdings-in-alphabet-inc-nasdaqgoogl/,https://www.americanbankingnews.com/wp-content/timthumb/timthumb.php?src=https://www.marketbeat.com/logos/google-inc-logo-1200x675.png&w=240&h=240&zc=2,2024-07-06T13:34:53Z,"Unionview LLC lowered its holdings in shares of Alphabet Inc. (NASDAQ:GOOGL – Free Report) by 1.3% during the first quarter, according to its most recent disclosure with the Securities and Exchange C… [+6819 chars]"
"{'id': None, 'name': 'ETF Daily News'}",MarketBeat News,Dash Acquisitions Inc. Grows Holdings in Alphabet Inc. (NASDAQ:GOOGL),"Dash Acquisitions Inc. grew its stake in shares of Alphabet Inc. (NASDAQ:GOOGL – Free Report) by 8.5% in the first quarter, Holdings Channel reports. The firm owned 8,276 shares of the information services provider’s stock after acquiring an additional 647 sh…",https://www.etfdailynews.com/2024/07/06/dash-acquisitions-inc-grows-holdings-in-alphabet-inc-nasdaqgoogl/,https://www.americanbankingnews.com/wp-content/timthumb/timthumb.php?src=https://www.marketbeat.com/logos/google-inc-logo-1200x675.png&w=240&h=240&zc=2,2024-07-06T12:16:49Z,"Dash Acquisitions Inc. grew its stake in shares of Alphabet Inc. (NASDAQ:GOOGL – Free Report) by 8.5% in the first quarter, Holdings Channel reports. The firm owned 8,276 shares of the information se… [+6546 chars]"
"{'id': None, 'name': 'ETF Daily News'}",MarketBeat News,MEAG MUNICH ERGO Kapitalanlagegesellschaft mbH Decreases Holdings in Alphabet Inc. (NASDAQ:GOOGL),"MEAG MUNICH ERGO Kapitalanlagegesellschaft mbH cut its stake in Alphabet Inc. (NASDAQ:GOOGL – Free Report) by 11.7% during the 1st quarter, according to its most recent Form 13F filing with the Securities and Exchange Commission (SEC). The firm owned 261,855 …",https://www.etfdailynews.com/2024/07/06/meag-munich-ergo-kapitalanlagegesellschaft-mbh-decreases-holdings-in-alphabet-inc-nasdaqgoogl/,https://www.americanbankingnews.com/wp-content/timthumb/timthumb.php?src=https://www.marketbeat.com/logos/google-inc-logo-1200x675.png&w=240&h=240&zc=2,2024-07-06T12:16:48Z,"MEAG MUNICH ERGO Kapitalanlagegesellschaft mbH cut its stake in Alphabet Inc. (NASDAQ:GOOGL – Free Report) by 11.7% during the 1st quarter, according to its most recent Form 13F filing with the Secur… [+6503 chars]"
"{'id': None, 'name': 'ETF Daily News'}",MarketBeat News,Narus Financial Partners LLC Sells 185 Shares of Alphabet Inc. (NASDAQ:GOOGL),"Narus Financial Partners LLC trimmed its position in Alphabet Inc. (NASDAQ:GOOGL – Free Report) by 1.9% in the first quarter, according to the company in its most recent Form 13F filing with the Securities & Exchange Commission. The firm owned 9,438 shares of…",https://www.etfdailynews.com/2024/07/06/narus-financial-partners-llc-sells-185-shares-of-alphabet-inc-nasdaqgoogl/,https://www.americanbankingnews.com/wp-content/timthumb/timthumb.php?src=https://www.marketbeat.com/logos/google-inc-logo-1200x675.png&w=240&h=240&zc=2,2024-07-06T12:16:48Z,"Narus Financial Partners LLC trimmed its position in Alphabet Inc. (NASDAQ:GOOGL – Free Report) by 1.9% in the first quarter, according to the company in its most recent Form 13F filing with the Secu… [+6472 chars]"
"{'id': None, 'name': 'ETF Daily News'}",MarketBeat News,Panoramic Investment Advisors LLC Lowers Position in Alphabet Inc. (NASDAQ:GOOGL),"Panoramic Investment Advisors LLC trimmed its stake in Alphabet Inc. (NASDAQ:GOOGL – Free Report) by 2.0% in the first quarter, according to the company in its most recent disclosure with the SEC. The firm owned 11,681 shares of the information services provi…",https://www.etfdailynews.com/2024/07/06/panoramic-investment-advisors-llc-lowers-position-in-alphabet-inc-nasdaqgoogl/,https://www.americanbankingnews.com/wp-content/timthumb/timthumb.php?src=https://www.marketbeat.com/logos/google-inc-logo-1200x675.png&w=240&h=240&zc=2,2024-07-06T11:42:50Z,"Panoramic Investment Advisors LLC trimmed its stake in Alphabet Inc. (NASDAQ:GOOGL – Free Report) by 2.0% in the first quarter, according to the company in its most recent disclosure with the SEC. Th… [+6651 chars]"
"{'id': None, 'name': 'ETF Daily News'}",MarketBeat News,Leonard Rickey Investment Advisors P.L.L.C. Sells 841 Shares of Alphabet Inc. (NASDAQ:GOOGL),"Leonard Rickey Investment Advisors P.L.L.C. lessened its position in Alphabet Inc. (NASDAQ:GOOGL – Free Report) by 10.2% in the first quarter, according to the company in its most recent 13F filing with the Securities and Exchange Commission (SEC). The firm o…",https://www.etfdailynews.com/2024/07/06/leonard-rickey-investment-advisors-p-l-l-c-sells-841-shares-of-alphabet-inc-nasdaqgoogl/,https://www.americanbankingnews.com/wp-content/timthumb/timthumb.php?src=https://www.marketbeat.com/logos/google-inc-logo-1200x675.png&w=240&h=240&zc=2,2024-07-06T11:42:49Z,"Leonard Rickey Investment Advisors P.L.L.C. lessened its position in Alphabet Inc. (NASDAQ:GOOGL – Free Report) by 10.2% in the first quarter, according to the company in its most recent 13F filing w… [+6232 chars]"
"{'id': None, 'name': 'ETF Daily News'}",MarketBeat News,Woodmont Investment Counsel LLC Has $3.93 Million Stock Position in Alphabet Inc. (NASDAQ:GOOGL),"Woodmont Investment Counsel LLC raised its position in shares of Alphabet Inc. (NASDAQ:GOOGL – Free Report) by 6.7% in the first quarter, according to the company in its most recent disclosure with the Securities & Exchange Commission. The firm owned 26,063 s…",https://www.etfdailynews.com/2024/07/06/woodmont-investment-counsel-llc-has-3-93-million-stock-position-in-alphabet-inc-nasdaqgoogl/,https://www.americanbankingnews.com/wp-content/timthumb/timthumb.php?src=https://www.marketbeat.com/logos/google-inc-logo-1200x675.png&w=240&h=240&zc=2,2024-07-06T11:42:49Z,"Woodmont Investment Counsel LLC raised its position in shares of Alphabet Inc. (NASDAQ:GOOGL – Free Report) by 6.7% in the first quarter, according to the company in its most recent disclosure with t… [+6710 chars]"
