source,author,title,description,url,urlToImage,publishedAt,content
"{'id': None, 'name': 'Investopedia'}",Naomi Buchanan,How Apple Could Boost Its Revenue by Selling Ads on Apple TV+ and More,"Apple could stand to double its revenue growth by selling ads on Apple TV+, Needham analysts said, and lifted the iPhone maker’s price target Wednesday.",https://www.investopedia.com/how-apple-could-boost-its-revenue-by-selling-ads-on-apple-tv-and-more-8676071,https://www.investopedia.com/thmb/fvrSy5gHkn6N8nDyLkrpsG1J1WA=/1500x0/filters:no_upscale():max_bytes(150000):strip_icc()/GettyImages-2157609766-6c5a55773ae44dc99358a43a547a4712.jpg,2024-07-10T21:59:41Z,<ul><li>Apple shares gained Wednesday after Needham analysts lifted their price target for the stock.</li><li>The analysts noted the iPhone maker is adding value for shareholders through its $110 bil… [+2056 chars]
"{'id': None, 'name': 'Investopedia'}",Michael Bromberg,S&P 500 Gains and Losses Today: Deckers Outdoor Stock Slips Amid Sales Slowdown,"The S&P 500 added 1% on Wednesday, July 10, 2024, posting a sixth straight record close as Fed Chair Jerome Powell gave a boost to rate-cut expectations.",https://www.investopedia.com/s-and-p-500-gains-and-losses-today-deckers-outdoor-stock-slips-amid-sales-slowdown-8676116,https://www.investopedia.com/thmb/xROm6Te2CBPZu8aap3qdtwRNtcs=/1500x0/filters:no_upscale():max_bytes(150000):strip_icc()/GettyImages-1862377402-9c4327effbea4f22bae4bb683d86793a.jpg,2024-07-10T20:52:53Z,"<ul><li>The S&amp;P 500 added 1% on Wednesday, July 10, 2024, posting its sixth straight record close as Fed Chair Jerome Powell provided a boost to rate-cut expectations.</li><li>Shares of lithium p… [+3563 chars]"
"{'id': None, 'name': 'Biztoc.com'}",investorplace.com,AI Will Generate Gains for All Kinds of Energy Stocks,"Hello, Reader.
Amidst the buzz and bright lights of the stock market’s obsession with artificial intelligence, many investors overlook a crucial factor…
The energy sector plays a pivotal role in powering this digital revolution.
And the actions of tech giant …",https://biztoc.com/x/6a81aece0ea2b698,https://biztoc.com/cdn/6a81aece0ea2b698_s.webp,2024-07-10T20:45:07Z,"Hello, Reader.Amidst the buzz and bright lights of the stock markets obsession with artificial intelligence, many investors overlook a crucial factorThe energy sector plays a pivotal role in powering… [+130 chars]"
"{'id': None, 'name': 'Macdailynews.com'}",MacDailyNews,Apple shares hit new all-time intraday and closing highs,"In Nasdaq trading today, shares of Apple Inc. rose to hit new all-time intraday and closing highs. Apple’s all-time intraday high was set on…
The post Apple shares hit new all-time intraday and closing highs appeared first on MacDailyNews.",https://macdailynews.com/2024/07/10/apple-shares-hit-new-all-time-intraday-and-closing-highs-83/,https://149359564.v2.pressablecdn.com/wp-content/uploads/2021/12/211207_stock_chart.png,2024-07-10T20:18:37Z,"In Nasdaq trading today, shares of Apple Inc. (AAPL) rose $4.30, or 1.88%, to $232.98, a new all-time closing high. Today’s intraday high was $233.08, also an all-time high for Apple stock.
Apples 5… [+1455 chars]"
"{'id': None, 'name': 'Investopedia'}",Naomi Buchanan,HubSpot Stock Dives on Reports Alphabet Abandoning Acquisition Effort,HubSpot shares tumbled Wednesday after reports that Google parent Alphabet was no longer trying to buy the CRM company.,https://www.investopedia.com/hubspot-stock-dives-on-google-reportedly-abandoning-acquisition-efforts-8676139,https://www.investopedia.com/thmb/X6CAa3iulyji9YYpxQAPTkDS-S4=/1500x0/filters:no_upscale():max_bytes(150000):strip_icc()/GettyImages-1664060819-5feb0a5c76264742a8694cec7bc9f947.jpg,2024-07-10T20:16:18Z,<ul><li>HubSpot shares fell Wednesday after reports that Google parent company Alphabet is no longer interested in buying the customer relationship management company.</li><li>Google stopped its effo… [+1226 chars]
"{'id': None, 'name': 'Biztoc.com'}",investorplace.com,3 Overvalued Social Media Stock You Shouldn’t Touch With a 10-Foot Pole,"Social media has taken the market by surprise. With Meta Platforms (NASDAQ:META) leading the way but joined by Alphabet (NASDAQ:GOOG, GOOGL), and Snap (NASDAQ:SNAP), the social media industry is expected to grow at a compound annual growth rate (CAGR) of near…",https://biztoc.com/x/c61bb153ebb20a18,https://biztoc.com/cdn/c61bb153ebb20a18_s.webp,2024-07-10T20:01:06Z,"Social media has taken the market by surprise. With Meta Platforms (NASDAQ:META) leading the way but joined by Alphabet (NASDAQ:GOOG, GOOGL), and Snap (NASDAQ:SNAP), the social media industry is expe… [+141 chars]"
"{'id': None, 'name': 'Investopedia'}",Naomi Buchanan,Is S&P 500 Earnings Growth Finally Set To Broaden Beyond the Magnificent 7?,"S&P 500 companies excluding the Magnificent 7 are expected to post their first quarter of year-over-year earnings growth since the fourth quarter of 2022, while growth for the Magnificent 7 slows, according to Bank of America analysts.",https://www.investopedia.com/is-s-and-p-500-earnings-growth-finally-set-to-broaden-beyond-the-magnificent-7-8675783,https://www.investopedia.com/thmb/swpGNNqN_EzN_BX5uTeMgtbSCrw=/1500x0/filters:no_upscale():max_bytes(150000):strip_icc()/GettyImages-2159012523-20ff80ad4d0548ba8aac31273074b049.jpg,2024-07-10T19:24:52Z,"<ul><li>S&amp;P 500 companies excluding the Magnificent 7 are expected to post their first quarter of year-over-year earnings growth since the fourth quarter of 2022, according to Bank of America ana… [+2991 chars]"
"{'id': None, 'name': 'Motley Fool Australia'}",Sebastian Bowen,Which US shares are ASX investors buying in 2024?,"The ASX's most popular US shares contain some familiar names...
The post Which US shares are ASX investors buying in 2024? appeared first on The Motley Fool Australia.",https://www.fool.com.au/2024/07/11/which-us-shares-are-asx-investors-buying-in-2024/,https://www.fool.com.au/wp-content/uploads/2021/01/us-share-1200x675.jpg,2024-07-10T18:30:00Z,"Here at the Motley Fool, we normally cover the movements and trends of the Australian share market and those of ASX shares. But in today's modern world, ASX investors are increasingly looking beyond … [+4560 chars]"
"{'id': None, 'name': 'Investing.com'}",Investing.com,YieldMax™ Launches Short COIN Option Income Strategy ETF (FIAT),YieldMax™ Launches Short COIN Option Income Strategy ETF (FIAT),https://www.investing.com/news/press-releases/yieldmax-launches-short-coin-option-income-strategy-etf-fiat-93CH-3514289,https://i-invdn-com.investing.com/news/news_pile_69x52._800x533_L_1419494209.jpg,2024-07-10T16:40:04Z,"CHICAGO, MILWAUKEE and NEW YORK, July 10, 2024 (GLOBE NEWSWIRE) -- YieldMax announced the launch today of the following ETF:
<ul><li>YieldMax Short COIN Option Income Strategy ETF (NYSE Arca: FIAT)<… [+24386 chars]"
"{'id': None, 'name': 'Biztoc.com'}",benzinga.com,"Market Clubhouse Morning Memo - July 10th, 2024 (Trade Strategy For SPY, QQQ, AAPL, MSFT, NVDA, GOOGL, META And TSLA)","Good Morning Traders! In today's Market Clubhouse Morning Memo, we will discuss SPY, QQQ, AAPL, MSFT, NVDA, GOOGL, META, and TSLA.
Our proprietary formula, exclusive to Market Clubhouse, dictates these price levels. This dynamic equation takes into account pr…",https://biztoc.com/x/a13abd9c1740968f,https://biztoc.com/cdn/a13abd9c1740968f_s.webp,2024-07-10T14:51:47Z,"Good Morning Traders! In today's Market Clubhouse Morning Memo, we will discuss SPY, QQQ, AAPL, MSFT, NVDA, GOOGL, META, and TSLA.Our proprietary formula, exclusive to Market Clubhouse, dictates thes… [+132 chars]"
"{'id': None, 'name': 'Biztoc.com'}",aol.com,Samsung is leaning on AI to power device sales,"Samsung took the wraps off of a litany of new devices on Wednesday during its Unpacked event in Paris, France. Not only did the company show off its latest foldable smartphones, the Android-powered (GOOG, GOOGL) Z Fold 6 and Z Flip 6, and its next-generation …",https://biztoc.com/x/559092b868a76759,https://biztoc.com/cdn/559092b868a76759_s.webp,2024-07-10T14:18:37Z,"Samsung took the wraps off of a litany of new devices on Wednesday during its Unpacked event in Paris, France. Not only did the company show off its latest foldable smartphones, the Android-powered (… [+128 chars]"
"{'id': None, 'name': 'Biztoc.com'}",aol.com,Samsung debuts Galaxy Flip 6 and Fold 6 smartphones in generative AI push,"Samsung on Wednesday took the wraps off of its latest foldable smartphones during its Unpacked event in Paris, France. The Google (GOOG, GOOGL) Android-powered phones, the Galaxy Z Fold 6 and Galaxy Z Flip 6, are a key differentiator for Samsung in its long-r…",https://biztoc.com/x/419c5708dd2df9a6,https://biztoc.com/cdn/419c5708dd2df9a6_s.webp,2024-07-10T13:12:16Z,"Samsung on Wednesday took the wraps off of its latest foldable smartphones during its Unpacked event in Paris, France. The Google (GOOG, GOOGL) Android-powered phones, the Galaxy Z Fold 6 and Galaxy … [+128 chars]"
"{'id': None, 'name': 'Yahoo Entertainment'}",Daniel Howley,Samsung debuts Galaxy Flip 6 and Fold 6 smartphones in generative AI push,Samsung's latest foldable phones are getting big AI upgrades.,https://finance.yahoo.com/news/samsung-debuts-galaxy-flip-6-and-fold-6-smartphones-in-generative-ai-push-130010488.html,https://s.yimg.com/ny/api/res/1.2/NJ0ro8fcMFPDbzvrmZo_KQ--/YXBwaWQ9aGlnaGxhbmRlcjt3PTEyMDA7aD05MDA-/https://s.yimg.com/os/creatr-uploaded-images/2024-07/09e62f10-3d6b-11ef-bde7-032061ab4c12,2024-07-10T13:00:10Z,"Samsung on Wednesday took the wraps off of its latest foldable smartphones during its Unpacked event in Paris, France. The Google (GOOG, GOOGL) Android-powered phones, the Galaxy Z Fold 6 and Galaxy … [+5331 chars]"
"{'id': None, 'name': 'ETF Daily News'}",MarketBeat News,American Institute for Advanced Investment Management LLP Increases Position in Alphabet Inc. (NASDAQ:GOOGL),"American Institute for Advanced Investment Management LLP boosted its holdings in shares of Alphabet Inc. (NASDAQ:GOOGL – Free Report) by 39.1% in the 1st quarter, according to the company in its most recent 13F filing with the Securities and Exchange Commiss…",https://www.etfdailynews.com/2024/07/10/american-institute-for-advanced-investment-management-llp-increases-position-in-alphabet-inc-nasdaqgoogl/,https://www.americanbankingnews.com/wp-content/timthumb/timthumb.php?src=https://www.marketbeat.com/logos/google-inc-logo-1200x675.png&w=240&h=240&zc=2,2024-07-10T12:40:44Z,"American Institute for Advanced Investment Management LLP boosted its holdings in shares of Alphabet Inc. (NASDAQ:GOOGL – Free Report) by 39.1% in the 1st quarter, according to the company in its mos… [+7036 chars]"
"{'id': None, 'name': 'ETF Daily News'}",MarketBeat News,Granite Bay Wealth Management LLC Trims Stock Holdings in Alphabet Inc. (NASDAQ:GOOGL),"Granite Bay Wealth Management LLC lowered its holdings in Alphabet Inc. (NASDAQ:GOOGL – Free Report) by 98.2% in the first quarter, according to its most recent Form 13F filing with the SEC. The fund owned 1,683 shares of the information services provider’s s…",https://www.etfdailynews.com/2024/07/10/granite-bay-wealth-management-llc-trims-stock-holdings-in-alphabet-inc-nasdaqgoogl/,https://www.americanbankingnews.com/wp-content/timthumb/timthumb.php?src=https://www.marketbeat.com/logos/google-inc-logo-1200x675.png&w=240&h=240&zc=2,2024-07-10T12:40:44Z,"Granite Bay Wealth Management LLC lowered its holdings in Alphabet Inc. (NASDAQ:GOOGL – Free Report) by 98.2% in the first quarter, according to its most recent Form 13F filing with the SEC. The fund… [+6748 chars]"
"{'id': None, 'name': 'ETF Daily News'}",MarketBeat News,Ashton Thomas Private Wealth LLC Grows Stock Holdings in Alphabet Inc. (NASDAQ:GOOGL),"Ashton Thomas Private Wealth LLC raised its stake in Alphabet Inc. (NASDAQ:GOOGL – Free Report) by 4.9% in the 1st quarter, according to the company in its most recent filing with the Securities and Exchange Commission (SEC). The firm owned 87,721 shares of t…",https://www.etfdailynews.com/2024/07/10/ashton-thomas-private-wealth-llc-grows-stock-holdings-in-alphabet-inc-nasdaqgoogl/,https://www.americanbankingnews.com/wp-content/timthumb/timthumb.php?src=https://www.marketbeat.com/logos/google-inc-logo-1200x675.png&w=240&h=240&zc=2,2024-07-10T12:40:43Z,"Ashton Thomas Private Wealth LLC raised its stake in Alphabet Inc. (NASDAQ:GOOGL – Free Report) by 4.9% in the 1st quarter, according to the company in its most recent filing with the Securities and … [+6874 chars]"
"{'id': None, 'name': 'Investopedia'}",Aaron McDade,"Microsoft, Apple Step Back From OpenAI Board Amid Antitrust Push","Microsoft has given up its non-voting board seat on OpenAI's board less than a year after taking it, while Apple has declined taking a similar role as its partnership with OpenAI grows, according to reports.",https://www.investopedia.com/microsoft-apple-step-back-from-openai-board-amid-antitrust-push-8675713,https://www.investopedia.com/thmb/r5qy-JRsq9VDgs1gbcGzet5nR9c=/1500x0/filters:no_upscale():max_bytes(150000):strip_icc()/GettyImages-1252639606-74d976e9b37e43b0b04eca26295ad4b4.jpg,2024-07-10T12:20:36Z,<ul><li>Microsoft reportedly has given up its non-voting board seat on OpenAI's board just eight months after taking it.</li><li>Apple reportedly will also opt out of taking a similar role observing … [+2749 chars]
"{'id': None, 'name': 'ETF Daily News'}",MarketBeat News,Alphabet Inc. (NASDAQ:GOOGL) Shares Purchased by Woodward Diversified Capital LLC,"Woodward Diversified Capital LLC raised its holdings in shares of Alphabet Inc. (NASDAQ:GOOGL – Free Report) by 10.6% during the first quarter, according to the company in its most recent Form 13F filing with the Securities & Exchange Commission. The institut…",https://www.etfdailynews.com/2024/07/10/alphabet-inc-nasdaqgoogl-shares-purchased-by-woodward-diversified-capital-llc/,https://www.americanbankingnews.com/wp-content/timthumb/timthumb.php?src=https://www.marketbeat.com/logos/google-inc-logo-1200x675.png&w=240&h=240&zc=2,2024-07-10T12:06:53Z,"Woodward Diversified Capital LLC raised its holdings in shares of Alphabet Inc. (NASDAQ:GOOGL – Free Report) by 10.6% during the first quarter, according to the company in its most recent Form 13F fi… [+7156 chars]"
"{'id': None, 'name': 'ETF Daily News'}",MarketBeat News,"Turtle Creek Wealth Advisors LLC Buys 1,982 Shares of Alphabet Inc. (NASDAQ:GOOGL)","Turtle Creek Wealth Advisors LLC lifted its stake in shares of Alphabet Inc. (NASDAQ:GOOGL – Free Report) by 15.4% during the first quarter, Holdings Channel.com reports. The firm owned 14,880 shares of the information services provider’s stock after acquirin…",https://www.etfdailynews.com/2024/07/10/turtle-creek-wealth-advisors-llc-buys-1982-shares-of-alphabet-inc-nasdaqgoogl/,https://www.americanbankingnews.com/wp-content/timthumb/timthumb.php?src=https://www.marketbeat.com/logos/google-inc-logo-1200x675.png&w=240&h=240&zc=2,2024-07-10T12:06:53Z,"Turtle Creek Wealth Advisors LLC lifted its stake in shares of Alphabet Inc. (NASDAQ:GOOGL – Free Report) by 15.4% during the first quarter, Holdings Channel.com reports. The firm owned 14,880 shares… [+6543 chars]"
"{'id': None, 'name': 'ETF Daily News'}",MarketBeat News,Concord Wealth Partners Increases Position in Alphabet Inc. (NASDAQ:GOOGL),"Concord Wealth Partners grew its stake in Alphabet Inc. (NASDAQ:GOOGL – Free Report) by 67.7% during the first quarter, according to its most recent 13F filing with the Securities and Exchange Commission. The firm owned 31,717 shares of the information servic…",https://www.etfdailynews.com/2024/07/10/concord-wealth-partners-increases-position-in-alphabet-inc-nasdaqgoogl/,https://www.americanbankingnews.com/wp-content/timthumb/timthumb.php?src=https://www.marketbeat.com/logos/google-inc-logo-1200x675.png&w=240&h=240&zc=2,2024-07-10T12:06:53Z,"Concord Wealth Partners grew its stake in Alphabet Inc. (NASDAQ:GOOGL – Free Report) by 67.7% during the first quarter, according to its most recent 13F filing with the Securities and Exchange Commis… [+6502 chars]"
"{'id': None, 'name': 'ETF Daily News'}",MarketBeat News,"Geneva Partners LLC Sells 1,211 Shares of Alphabet Inc. (NASDAQ:GOOGL)","Geneva Partners LLC cut its holdings in Alphabet Inc. (NASDAQ:GOOGL – Free Report) by 2.4% during the first quarter, according to its most recent disclosure with the Securities & Exchange Commission. The fund owned 50,196 shares of the information services pr…",https://www.etfdailynews.com/2024/07/10/geneva-partners-llc-sells-1211-shares-of-alphabet-inc-nasdaqgoogl/,https://www.americanbankingnews.com/wp-content/timthumb/timthumb.php?src=https://www.marketbeat.com/logos/google-inc-logo-1200x675.png&w=240&h=240&zc=2,2024-07-10T12:06:53Z,"Geneva Partners LLC cut its holdings in Alphabet Inc. (NASDAQ:GOOGL – Free Report) by 2.4% during the first quarter, according to its most recent disclosure with the Securities &amp; Exchange Commiss… [+6633 chars]"
"{'id': None, 'name': 'ETF Daily News'}",MarketBeat News,"RF&L Wealth Management LLC Makes New $215,000 Investment in Alphabet Inc. (NASDAQ:GOOGL)","RF&L Wealth Management LLC purchased a new position in Alphabet Inc. (NASDAQ:GOOGL – Free Report) during the 1st quarter, according to its most recent 13F filing with the SEC. The firm purchased 1,423 shares of the information services provider’s stock, value…",https://www.etfdailynews.com/2024/07/10/rfl-wealth-management-llc-makes-new-215000-investment-in-alphabet-inc-nasdaqgoogl/,https://www.americanbankingnews.com/wp-content/timthumb/timthumb.php?src=https://www.marketbeat.com/logos/google-inc-logo-1200x675.png&w=240&h=240&zc=2,2024-07-10T12:06:52Z,"RF&amp;L Wealth Management LLC purchased a new position in Alphabet Inc. (NASDAQ:GOOGL – Free Report) during the 1st quarter, according to its most recent 13F filing with the SEC. The firm purchased … [+6857 chars]"
"{'id': None, 'name': 'ETF Daily News'}",MarketBeat News,Alphabet Inc. (NASDAQ:GOOGL) Shares Sold by Privium Fund Management B.V.,"Privium Fund Management B.V. decreased its position in shares of Alphabet Inc. (NASDAQ:GOOGL – Free Report) by 14.3% during the first quarter, Holdings Channel.com reports. The firm owned 60,000 shares of the information services provider’s stock after sellin…",https://www.etfdailynews.com/2024/07/10/alphabet-inc-nasdaqgoogl-shares-sold-by-privium-fund-management-b-v/,https://www.americanbankingnews.com/wp-content/timthumb/timthumb.php?src=https://www.marketbeat.com/logos/google-inc-logo-1200x675.png&w=240&h=240&zc=2,2024-07-10T11:35:02Z,"Privium Fund Management B.V. decreased its position in shares of Alphabet Inc. (NASDAQ:GOOGL – Free Report) by 14.3% during the first quarter, Holdings Channel.com reports. The firm owned 60,000 shar… [+6470 chars]"
"{'id': None, 'name': 'ETF Daily News'}",MarketBeat News,Alphabet Inc. (NASDAQ:GOOGL) is Strategic Advisors LLC’s 5th Largest Position,"Strategic Advisors LLC cut its stake in Alphabet Inc. (NASDAQ:GOOGL – Free Report) by 7.1% in the 1st quarter, Holdings Channel reports. The fund owned 113,567 shares of the information services provider’s stock after selling 8,677 shares during the quarter. …",https://www.etfdailynews.com/2024/07/10/alphabet-inc-nasdaqgoogl-is-strategic-advisors-llcs-5th-largest-position/,https://www.americanbankingnews.com/wp-content/timthumb/timthumb.php?src=https://www.marketbeat.com/logos/google-inc-logo-1200x675.png&w=240&h=240&zc=2,2024-07-10T10:24:42Z,"Strategic Advisors LLC cut its stake in Alphabet Inc. (NASDAQ:GOOGL – Free Report) by 7.1% in the 1st quarter, Holdings Channel reports. The fund owned 113,567 shares of the information services prov… [+6849 chars]"
"{'id': None, 'name': 'ETF Daily News'}",MarketBeat News,Kesler Norman & Wride LLC Grows Position in Alphabet Inc. (NASDAQ:GOOGL),"Kesler Norman & Wride LLC increased its position in shares of Alphabet Inc. (NASDAQ:GOOGL – Free Report) by 164.0% during the first quarter, according to its most recent Form 13F filing with the SEC. The firm owned 18,267 shares of the information services pr…",https://www.etfdailynews.com/2024/07/10/kesler-norman-wride-llc-grows-position-in-alphabet-inc-nasdaqgoogl/,https://www.americanbankingnews.com/wp-content/timthumb/timthumb.php?src=https://www.marketbeat.com/logos/google-inc-logo-1200x675.png&w=240&h=240&zc=2,2024-07-10T10:24:42Z,"Kesler Norman &amp; Wride LLC increased its position in shares of Alphabet Inc. (NASDAQ:GOOGL – Free Report) by 164.0% during the first quarter, according to its most recent Form 13F filing with the … [+6541 chars]"
"{'id': None, 'name': 'Biztoc.com'}",aol.com,Is It Too Late to Buy Alphabet Stock?,"It's hard to imagine that brands like Android, YouTube, Google, and even Fitbit fall under the same company. Each is a subsidiary of Alphabet (NASDAQ: GOOGL) (NASDAQ: GOOG), making the company one of the most successful organizations in history. Its stock pri…",https://biztoc.com/x/3ec0ccabcfc70c87,https://biztoc.com/cdn/3ec0ccabcfc70c87_s.webp,2024-07-10T10:03:35Z,"It's hard to imagine that brands like Android, YouTube, Google, and even Fitbit fall under the same company. Each is a subsidiary of Alphabet (NASDAQ: GOOGL) (NASDAQ: GOOG), making the company one of… [+130 chars]"
"{'id': None, 'name': 'ETF Daily News'}",MarketBeat News,Alphabet Inc. (NASDAQ:GOOGL) Shares Bought by FORVIS Wealth Advisors LLC,"FORVIS Wealth Advisors LLC raised its holdings in Alphabet Inc. (NASDAQ:GOOGL – Free Report) by 32.9% during the first quarter, according to the company in its most recent filing with the Securities & Exchange Commission. The institutional investor owned 99,6…",https://www.etfdailynews.com/2024/07/10/alphabet-inc-nasdaqgoogl-shares-bought-by-forvis-wealth-advisors-llc/,https://www.americanbankingnews.com/wp-content/timthumb/timthumb.php?src=https://www.marketbeat.com/logos/google-inc-logo-1200x675.png&w=240&h=240&zc=2,2024-07-10T09:52:52Z,"FORVIS Wealth Advisors LLC raised its holdings in Alphabet Inc. (NASDAQ:GOOGL – Free Report) by 32.9% during the first quarter, according to the company in its most recent filing with the Securities … [+6396 chars]"
"{'id': None, 'name': 'ETF Daily News'}",MarketBeat News,"GenTrust LLC Invests $755,000 in Alphabet Inc. (NASDAQ:GOOGL)","GenTrust LLC acquired a new stake in shares of Alphabet Inc. (NASDAQ:GOOGL – Free Report) during the 1st quarter, according to the company in its most recent disclosure with the Securities & Exchange Commission. The firm acquired 5,005 shares of the informati…",https://www.etfdailynews.com/2024/07/10/gentrust-llc-invests-755000-in-alphabet-inc-nasdaqgoogl/,https://www.americanbankingnews.com/wp-content/timthumb/timthumb.php?src=https://www.marketbeat.com/logos/google-inc-logo-1200x675.png&w=240&h=240&zc=2,2024-07-10T09:20:44Z,"GenTrust LLC acquired a new stake in shares of Alphabet Inc. (NASDAQ:GOOGL – Free Report) during the 1st quarter, according to the company in its most recent disclosure with the Securities &amp; Exch… [+6782 chars]"
"{'id': None, 'name': 'ETF Daily News'}",MarketBeat News,Veracity Capital LLC Has $3 Million Holdings in Alphabet Inc. (NASDAQ:GOOGL),"Veracity Capital LLC increased its holdings in shares of Alphabet Inc. (NASDAQ:GOOGL – Free Report) by 7.2% during the 1st quarter, HoldingsChannel.com reports. The institutional investor owned 19,902 shares of the information services provider’s stock after …",https://www.etfdailynews.com/2024/07/10/veracity-capital-llc-has-3-million-holdings-in-alphabet-inc-nasdaqgoogl/,https://www.americanbankingnews.com/wp-content/timthumb/timthumb.php?src=https://www.marketbeat.com/logos/google-inc-logo-1200x675.png&w=240&h=240&zc=2,2024-07-10T09:20:43Z,"Veracity Capital LLC increased its holdings in shares of Alphabet Inc. (NASDAQ:GOOGL – Free Report) by 7.2% during the 1st quarter, HoldingsChannel.com reports. The institutional investor owned 19,90… [+6541 chars]"
"{'id': None, 'name': 'Macdailynews.com'}",MacDailyNews,Apple shares hit new all-time intraday and closing highs,"In Nasdaq trading today, shares of Apple Inc. rose to hit new all-time intraday and closing highs. Apple’s all-time intraday high was set on…
The post Apple shares hit new all-time intraday and closing highs appeared first on MacDailyNews.",https://macdailynews.com/2024/07/09/apple-shares-hit-new-all-time-intraday-and-closing-highs-240709/,https://149359564.v2.pressablecdn.com/wp-content/uploads/2021/12/211207_stock_chart.png,2024-07-09T20:15:51Z,"In Nasdaq trading today, shares of Apple Inc. (AAPL) rose $0.86, or 0.38%, to $228.68, a new all-time closing high. Today’s intraday high was $229.40, also an all-time high for Apple stock.
Apples 5… [+1466 chars]"
"{'id': None, 'name': 'Investopedia'}",Aaron McDade,Apple's App Store Revenue Seen Rising 13% in Latest Quarter,Bank of America analysts said Tuesday that revenue for Apple's App Store rose 13% in the third quarter compared with the same time last year.,https://www.investopedia.com/apple-app-store-revenue-china-iphones-europe-dma-8675292,https://www.investopedia.com/thmb/NJMEWBtC1Y-1wayc1lDlqOsYWqs=/1500x0/filters:no_upscale():max_bytes(150000):strip_icc()/INV_AppleAppStoreApp_GettyImages-2158694665-ec2362bb916348d99d3d5cf427e354ec.jpg,2024-07-09T19:49:40Z,"<ul><li>Apple's quarterly App Store revenue is forecast to have risen 13% year-over-year, Bank of America analysts said Tuesday.</li><li>Revenue from the store reportedly rose 10% in China in June am… [+2916 chars]"
