source,author,title,description,url,urlToImage,publishedAt,content
"{'id': None, 'name': 'Investopedia'}",Naomi Buchanan,How Apple Could Boost Its Revenue by Selling Ads on Apple TV+ and More,"Apple could stand to double its revenue growth by selling ads on Apple TV+, Needham analysts said, and lifted the iPhone maker’s price target Wednesday.",https://www.investopedia.com/how-apple-could-boost-its-revenue-by-selling-ads-on-apple-tv-and-more-8676071,https://www.investopedia.com/thmb/fvrSy5gHkn6N8nDyLkrpsG1J1WA=/1500x0/filters:no_upscale():max_bytes(150000):strip_icc()/GettyImages-2157609766-6c5a55773ae44dc99358a43a547a4712.jpg,2024-07-10T21:59:41Z,<ul><li>Apple shares gained Wednesday after Needham analysts lifted their price target for the stock.</li><li>The analysts noted the iPhone maker is adding value for shareholders through its $110 bil… [+2056 chars]
"{'id': None, 'name': 'Macdailynews.com'}",MacDailyNews,Apple shares hit new all-time intraday and closing highs,"In Nasdaq trading today, shares of Apple Inc. rose to hit new all-time intraday and closing highs. Apple’s all-time intraday high was set on…
The post Apple shares hit new all-time intraday and closing highs appeared first on MacDailyNews.",https://macdailynews.com/2024/07/10/apple-shares-hit-new-all-time-intraday-and-closing-highs-83/,https://149359564.v2.pressablecdn.com/wp-content/uploads/2021/12/211207_stock_chart.png,2024-07-10T20:18:37Z,"In Nasdaq trading today, shares of Apple Inc. (AAPL) rose $4.30, or 1.88%, to $232.98, a new all-time closing high. Today’s intraday high was $233.08, also an all-time high for Apple stock.
Apples 5… [+1455 chars]"
"{'id': None, 'name': 'Investopedia'}",Naomi Buchanan,HubSpot Stock Dives on Reports Alphabet Abandoning Acquisition Effort,HubSpot shares tumbled Wednesday after reports that Google parent Alphabet was no longer trying to buy the CRM company.,https://www.investopedia.com/hubspot-stock-dives-on-google-reportedly-abandoning-acquisition-efforts-8676139,https://www.investopedia.com/thmb/X6CAa3iulyji9YYpxQAPTkDS-S4=/1500x0/filters:no_upscale():max_bytes(150000):strip_icc()/GettyImages-1664060819-5feb0a5c76264742a8694cec7bc9f947.jpg,2024-07-10T20:16:18Z,<ul><li>HubSpot shares fell Wednesday after reports that Google parent company Alphabet is no longer interested in buying the customer relationship management company.</li><li>Google stopped its effo… [+1226 chars]
"{'id': None, 'name': 'Investopedia'}",Naomi Buchanan,Is S&P 500 Earnings Growth Finally Set To Broaden Beyond the Magnificent 7?,"S&P 500 companies excluding the Magnificent 7 are expected to post their first quarter of year-over-year earnings growth since the fourth quarter of 2022, while growth for the Magnificent 7 slows, according to Bank of America analysts.",https://www.investopedia.com/is-s-and-p-500-earnings-growth-finally-set-to-broaden-beyond-the-magnificent-7-8675783,https://www.investopedia.com/thmb/swpGNNqN_EzN_BX5uTeMgtbSCrw=/1500x0/filters:no_upscale():max_bytes(150000):strip_icc()/GettyImages-2159012523-20ff80ad4d0548ba8aac31273074b049.jpg,2024-07-10T19:24:52Z,"<ul><li>S&amp;P 500 companies excluding the Magnificent 7 are expected to post their first quarter of year-over-year earnings growth since the fourth quarter of 2022, according to Bank of America ana… [+2991 chars]"
"{'id': None, 'name': 'Biztoc.com'}",observer.com,Microsoft and Apple Withdraw from OpenAI’s Board as Antitrust Scrutiny Heats Up,"As regulators across the U.S. and Europe continue to crack down on corporate partnerships in the buzzing A.I. world, both Microsoft (MSFT) and Apple (AAPL) are abandoning their board seats at OpenAI. Microsoft executive Dee Templeton has been a non-voting boa…",https://biztoc.com/x/039782b818e54604,https://biztoc.com/cdn/039782b818e54604_s.webp,2024-07-10T19:16:35Z,"As regulators across the U.S. and Europe continue to crack down on corporate partnerships in the buzzing A.I. world, both Microsoft (MSFT) and Apple (AAPL) are abandoning their board seats at OpenAI.… [+138 chars]"
"{'id': None, 'name': 'Observer'}","Alexandra Tremayne-Pengelly, Alexandra Tremayne-Pengelly",Microsoft and Apple Withdraw from OpenAI’s Board as Antitrust Scrutiny Heats Up,"In a letter to OpenAI, Microsoft said it is withdrawing from its non-voting board seat ""effective immediately.""",https://observer.com/2024/07/microsoft-apple-withdraw-openai-board-antitrust-scrutiny/,https://observer.com/wp-content/uploads/sites/2/2024/07/GettyImages-1778706504.jpg?quality=80,2024-07-10T19:13:09Z,"Microsoft, led by CEO Satya Nadella, is OpenAI’s largest investor. Justin Sullivan/Getty Images
As regulators across the U.S. and Europe continue to crack down on corporate partnerships in the buzzi… [+3611 chars]"
"{'id': None, 'name': 'Motley Fool Australia'}",Sebastian Bowen,Which US shares are ASX investors buying in 2024?,"The ASX's most popular US shares contain some familiar names...
The post Which US shares are ASX investors buying in 2024? appeared first on The Motley Fool Australia.",https://www.fool.com.au/2024/07/11/which-us-shares-are-asx-investors-buying-in-2024/,https://www.fool.com.au/wp-content/uploads/2021/01/us-share-1200x675.jpg,2024-07-10T18:30:00Z,"Here at the Motley Fool, we normally cover the movements and trends of the Australian share market and those of ASX shares. But in today's modern world, ASX investors are increasingly looking beyond … [+4560 chars]"
"{'id': None, 'name': 'Investopedia'}",Naomi Buchanan,Can Nvidia Sustain Its AI-Fueled Surge as Stock Price Nears Record High?,"Nvidia shares gained again on Wednesday, nearing a record high, as the chipmaker continues to benefit from investor enthusiasm about the company's strong position during the AI boom.",https://www.investopedia.com/nvidia-stock-price-nears-record-high-ai-8675899,https://www.investopedia.com/thmb/sIDkhH2WCEYF9NYfa7jDkKcaAns=/1500x0/filters:no_upscale():max_bytes(150000):strip_icc()/GettyImages-2018745950-364780d38026412e82b0d108384ca940.jpg,2024-07-10T17:59:53Z,"<ul><li>Nvidia stock rose again Wednesday, approaching the record high it set last month, as the chipmaker continues to benefit from investor enthusiasm about the company's strong position during the… [+3510 chars]"
"{'id': None, 'name': 'Investing.com'}",Investing.com,YieldMax™ Launches Short COIN Option Income Strategy ETF (FIAT),YieldMax™ Launches Short COIN Option Income Strategy ETF (FIAT),https://www.investing.com/news/press-releases/yieldmax-launches-short-coin-option-income-strategy-etf-fiat-93CH-3514289,https://i-invdn-com.investing.com/news/news_pile_69x52._800x533_L_1419494209.jpg,2024-07-10T16:40:04Z,"CHICAGO, MILWAUKEE and NEW YORK, July 10, 2024 (GLOBE NEWSWIRE) -- YieldMax announced the launch today of the following ETF:
<ul><li>YieldMax Short COIN Option Income Strategy ETF (NYSE Arca: FIAT)<… [+24386 chars]"
"{'id': None, 'name': 'Biztoc.com'}",benzinga.com,"Market Clubhouse Morning Memo - July 10th, 2024 (Trade Strategy For SPY, QQQ, AAPL, MSFT, NVDA, GOOGL, META And TSLA)","Good Morning Traders! In today's Market Clubhouse Morning Memo, we will discuss SPY, QQQ, AAPL, MSFT, NVDA, GOOGL, META, and TSLA.
Our proprietary formula, exclusive to Market Clubhouse, dictates these price levels. This dynamic equation takes into account pr…",https://biztoc.com/x/a13abd9c1740968f,https://biztoc.com/cdn/a13abd9c1740968f_s.webp,2024-07-10T14:51:47Z,"Good Morning Traders! In today's Market Clubhouse Morning Memo, we will discuss SPY, QQQ, AAPL, MSFT, NVDA, GOOGL, META, and TSLA.Our proprietary formula, exclusive to Market Clubhouse, dictates thes… [+132 chars]"
"{'id': None, 'name': 'Forbes'}","Trefis Team, Contributor, 
 Trefis Team, Contributor
 https://www.forbes.com/sites/greatspeculations/people/trefis/",What’s Happening With Chevron’s Stock?,"Almost flat year-to-date, at the current price of around $154 per share, we believe Chevron Corporation (NYSE: CVX), a company manufacturing and selling a range of..",https://www.forbes.com/sites/greatspeculations/2024/07/10/whats-happening-with-chevrons-stock/,https://imageio.forbes.com/specials-images/imageserve/668e0ce6938a62c907d98a89/0x0.jpg?format=jpg&height=900&width=1600&fit=bounds,2024-07-10T14:00:35Z,"AUSTIN, TEXAS - MAY 29: A sign is on display at a Chevron gas station on May 29, 2024 in Austin, ... [+] Texas. After Chevron offered to acquire Hess last October but was stalled due to an ongoing as… [+5507 chars]"
"{'id': None, 'name': 'Yahoo Entertainment'}",Alexandra Canal,Stock market today: US stocks hold near records as Powell buoys rate-cut hopes,"Jerome Powell steps up for part 2 of his policy update to Congress, with investors on the alert for more clues to rate-cut prospects.",https://finance.yahoo.com/news/live/stock-market-today-us-stocks-hold-near-records-as-powell-buoys-rate-cut-hopes-133104537.html,https://s.yimg.com/ny/api/res/1.2/cSuKzfiOZLsOt7yLhuBZBg--/YXBwaWQ9aGlnaGxhbmRlcjt3PTEyMDA7aD04MDA-/https://s.yimg.com/os/creatr-uploaded-images/2023-05/0bfc9de0-f8b4-11ed-bf4e-c69e02b11f47,2024-07-10T13:31:04Z,"US stocks held near all-time highs on Wednesday as Jerome Powell's remarks to the Senate buoyed rate-cut hopes, with the Federal Reserve chair set to return to Congress for another day of testimony.… [+3593 chars]"
"{'id': None, 'name': 'Forbes'}","Trefis Team, Contributor, 
 Trefis Team, Contributor
 https://www.forbes.com/sites/greatspeculations/people/trefis/",Will Deere Stock Rebound To Its 2022 Highs Of Around $440?,"Deere stock (NYSE: DE) currently trades at $355 per share, around 20% below its peak level of $438 seen in April 2022. In comparison, its peer – Caterpillar stock..",https://www.forbes.com/sites/greatspeculations/2024/07/10/will-deere-stock-rebound-to-its-2022-highs-of-around-440/,https://imageio.forbes.com/specials-images/imageserve/668e0c00c4cc82f1bd76a714/0x0.jpg?format=jpg&height=900&width=1600&fit=bounds,2024-07-10T13:00:29Z,"12 March 2024, Brandenburg, Krausnick-Groß Wasserburg: Large agricultural equipment stands in front ... [+] of the venue of the 14th State Farmers' Day of the Brandenburg State Farmers' Association. … [+7211 chars]"
"{'id': None, 'name': 'Investopedia'}",Aaron McDade,"Microsoft, Apple Step Back From OpenAI Board Amid Antitrust Push","Microsoft has given up its non-voting board seat on OpenAI's board less than a year after taking it, while Apple has declined taking a similar role as its partnership with OpenAI grows, according to reports.",https://www.investopedia.com/microsoft-apple-step-back-from-openai-board-amid-antitrust-push-8675713,https://www.investopedia.com/thmb/r5qy-JRsq9VDgs1gbcGzet5nR9c=/1500x0/filters:no_upscale():max_bytes(150000):strip_icc()/GettyImages-1252639606-74d976e9b37e43b0b04eca26295ad4b4.jpg,2024-07-10T12:20:36Z,<ul><li>Microsoft reportedly has given up its non-voting board seat on OpenAI's board just eight months after taking it.</li><li>Apple reportedly will also opt out of taking a similar role observing … [+2749 chars]
"{'id': None, 'name': 'Forbes'}","Brett Owens, Contributor, 
 Brett Owens, Contributor
 https://www.forbes.com/sites/brettowens/",4 Reasons Why Railroad Stocks Will Soar As The 2020s Roll On,Railroad stocks are set to roll and we’re going to climb aboard with two stocks—including one that’s hiked payouts by 50% in five years.,https://www.forbes.com/sites/brettowens/2024/07/10/4-reasons-why-railroad-stocks-will-soar-as-the-2020s-roll-on/,https://imageio.forbes.com/specials-images/imageserve/66884202014ecd02ffb32538/0x0.jpg?format=jpg&height=900&width=1600&fit=bounds,2024-07-10T12:15:00Z,"Distribution and transportation using railroads.
getty
Railroad stocks are set to roll and were going to climb aboard with two stocksincluding one thats hiked payouts by 50% in five yearswell delve… [+5918 chars]"
"{'id': None, 'name': ""Investor's Business Daily""}",Investor's Business Daily,"AI Stock Launches A Breakout As Microsoft, Nvidia Fuel Gains","As Microsoft and Nvidia continue to rise, fellow AI leader Palantir launches a fresh breakout.",https://www.investors.com/research/breakout-stocks-technical-analysis/palantir-stock-rockets-microsoft-nvidia-rise/,https://www.investors.com/wp-content/uploads/2024/07/Stock-shuttle-liftoff-adobe.jpg,2024-07-10T12:05:21Z,"Artificial intelligence behemoths Microsoft (MSFT) and Nvidia (NVDA) remain near all-time highs. Riding that wave, fellow AI stockPalantir (PLTR) has just launched a breakout. As of Tuesday's close, … [+2817 chars]"
"{'id': None, 'name': 'Forbes'}","Trefis Team, Contributor, 
 Trefis Team, Contributor
 https://www.forbes.com/sites/greatspeculations/people/trefis/",What To Expect From PepsiCo’s Q2?,"PepsiCo (NYSE: PEP) will report its Q2 2024 results on Thursday, July 11. We expect the company’s revenues to come in at $22.8 billion and earnings at $2.15 on a per..",https://www.forbes.com/sites/greatspeculations/2024/07/10/what-to-expect-from-pepsicos-q2/,https://imageio.forbes.com/specials-images/imageserve/668e0ac60332dd2a59d60043/0x0.jpg?format=jpg&height=900&width=1600&fit=bounds,2024-07-10T12:00:57Z,"Rows of original Oat So Simple pots by Quaker Oats, convenient recylcable pots of porridge oats, ... [+] stacked on top of one another on a supermarket shelf on 3rd July, 2022 in Leeds, United Kingdo… [+4058 chars]"
"{'id': None, 'name': 'Investopedia'}",Terry Lane,5 Things to Know Before the Stock Market Opens,"Powell heads back to Capitol Hill, Microsoft and Apple give up OpenAI board observer seats, TSMC reports higher June revenue, and Samsung workers extend strike. Here's what investors need to know today.",https://www.investopedia.com/5-things-to-know-before-the-stock-market-opens-july-10-2024-8675719,https://www.investopedia.com/thmb/0WcDntZb4oQTLNi5qpS-LwGNg0A=/1500x0/filters:no_upscale():max_bytes(150000):strip_icc()/GettyImages-2160476843-68b32e1472d2448b8d8f2cd7366be082.jpg,2024-07-10T11:48:00Z,Federal Reserve Chair Jerome Powell returns to Capitol Hill for a second day of testimony; Microsoft (MSFT) and Apple (AAPL) will not take observer seats on the board of ChatGPT maker OpenAI; Taiwan … [+3556 chars]
"{'id': None, 'name': 'Biztoc.com'}",theglobeandmail.com,Microsoft ditches OpenAI board observer seat amid regulatory scrutiny,"Microsoft MSFT-Q has ditched the board observer seat at OpenAI that has drawn regulatory scrutiny on both sides of the Atlantic, saying it was not necessary after the AI start-up’s governance had improved significantly in the past eight months.
Apple AAPL-Q, …",https://biztoc.com/x/93cb9566b908ac98,https://biztoc.com/cdn/93cb9566b908ac98_s.webp,2024-07-10T11:31:53Z,"Microsoft MSFT-Q has ditched the board observer seat at OpenAI that has drawn regulatory scrutiny on both sides of the Atlantic, saying it was not necessary after the AI start-ups governance had impr… [+140 chars]"
"{'id': None, 'name': 'Forbes'}","Trefis Team, Contributor, 
 Trefis Team, Contributor
 https://www.forbes.com/sites/greatspeculations/people/trefis/",Should You Pick Corning Stock After 40% Gains This Year Amid AI Boost?,"Corning stock (NYSE: GLW) saw a 10% rise over the last five days, faring better than its peer — General Electric stock – up 2%. The rise in GLW stock this..",https://www.forbes.com/sites/greatspeculations/2024/07/10/should-you-pick-corning-stock-after-40-gains-this-year-amid-ai-boost/,https://imageio.forbes.com/specials-images/imageserve/61f0126db77f2c141a46d1ec/0x0.jpg?format=jpg&height=900&width=1600&fit=bounds,2024-07-10T11:00:51Z,UKRAINE - 2021/10/09: In this photo illustration Corning Incorporated logo seen displayed on a ... [+] smartphone and in the background. (Photo Illustration by Igor Golovniov/SOPA Images/LightRocket … [+3546 chars]
"{'id': None, 'name': 'Yahoo Entertainment'}",Karen Friar,Stock market today: US futures hold near records as Powell buoys rate-cut hopes,"Jerome Powell steps up for part 2 of his policy update to Congress, with investors on the alert for more clues to rate-cut prospects.",https://finance.yahoo.com/news/live/stock-market-today-us-futures-hold-near-records-as-powell-buoys-rate-cut-hopes-105032646.html,https://s.yimg.com/ny/api/res/1.2/cSuKzfiOZLsOt7yLhuBZBg--/YXBwaWQ9aGlnaGxhbmRlcjt3PTEyMDA7aD04MDA-/https://s.yimg.com/os/creatr-uploaded-images/2023-05/0bfc9de0-f8b4-11ed-bf4e-c69e02b11f47,2024-07-10T10:50:32Z,"US stocks held near all-time highs on Wednesday as Jerome Powell's remarks to the Senate buoyed rate-cut hopes, with the Federal Reserve chair set to return to Congress for another day of testimony.… [+3019 chars]"
"{'id': None, 'name': 'ETF Daily News'}",MarketBeat News,Acorn Wealth Advisors LLC Sells 52 Shares of Microsoft Co. (NASDAQ:MSFT),"Acorn Wealth Advisors LLC lowered its position in shares of Microsoft Co. (NASDAQ:MSFT – Free Report) by 0.3% during the first quarter, according to its most recent Form 13F filing with the Securities and Exchange Commission (SEC). The firm owned 15,186 share…",https://www.etfdailynews.com/2024/07/10/acorn-wealth-advisors-llc-sells-52-shares-of-microsoft-co-nasdaqmsft/,https://www.americanbankingnews.com/wp-content/timthumb/timthumb.php?src=https://www.marketbeat.com/logos/microsoft-corporation-logo-1200x675.png&w=240&h=240&zc=2,2024-07-10T10:34:44Z,"Acorn Wealth Advisors LLC lowered its position in shares of Microsoft Co. (NASDAQ:MSFT – Free Report) by 0.3% during the first quarter, according to its most recent Form 13F filing with the Securitie… [+6725 chars]"
"{'id': None, 'name': 'ETF Daily News'}",MarketBeat News,Microsoft Co. (NASDAQ:MSFT) Shares Sold by UMB Bank n.a.,"UMB Bank n.a. lessened its position in Microsoft Co. (NASDAQ:MSFT – Free Report) by 2.5% in the first quarter, according to the company in its most recent Form 13F filing with the Securities and Exchange Commission (SEC). The fund owned 581,348 shares of the …",https://www.etfdailynews.com/2024/07/10/microsoft-co-nasdaqmsft-shares-sold-by-umb-bank-n-a/,https://www.americanbankingnews.com/wp-content/timthumb/timthumb.php?src=https://www.marketbeat.com/logos/microsoft-corporation-logo-1200x675.png&w=240&h=240&zc=2,2024-07-10T10:34:44Z,"UMB Bank n.a. lessened its position in Microsoft Co. (NASDAQ:MSFT – Free Report) by 2.5% in the first quarter, according to the company in its most recent Form 13F filing with the Securities and Exch… [+6511 chars]"
"{'id': None, 'name': 'ETF Daily News'}",MarketBeat News,Prairiewood Capital LLC Has $1.92 Million Holdings in Microsoft Co. (NASDAQ:MSFT),"Prairiewood Capital LLC lessened its holdings in Microsoft Co. (NASDAQ:MSFT – Free Report) by 1.7% during the first quarter, according to its most recent 13F filing with the Securities and Exchange Commission (SEC). The fund owned 4,570 shares of the software…",https://www.etfdailynews.com/2024/07/10/prairiewood-capital-llc-has-1-92-million-holdings-in-microsoft-co-nasdaqmsft/,https://www.americanbankingnews.com/wp-content/timthumb/timthumb.php?src=https://www.marketbeat.com/logos/microsoft-corporation-logo-1200x675.png&w=240&h=240&zc=2,2024-07-10T10:34:43Z,"Prairiewood Capital LLC lessened its holdings in Microsoft Co. (NASDAQ:MSFT – Free Report) by 1.7% during the first quarter, according to its most recent 13F filing with the Securities and Exchange C… [+6989 chars]"
"{'id': None, 'name': 'Forbes'}","Trefis Team, Contributor, 
 Trefis Team, Contributor
 https://www.forbes.com/sites/greatspeculations/people/trefis/","JPMorgan Stock Is Up 21% YTD, What To Expect From Q2 Results?","JPMorgan (NYSE: JPM) stock has gained 21% YTD, as compared to the 17% rise in the S&P500 index. Notably, JPMorgan’s peer Citigroup (NYSE: C) is up 22% YTD.",https://www.forbes.com/sites/greatspeculations/2024/07/10/jpmorgan-stock-is-up-21-ytd-what-to-expect-from-q2-results/,https://imageio.forbes.com/specials-images/imageserve/668e08b349ce91591d629f76/0x0.jpg?format=jpg&height=900&width=1600&fit=bounds,2024-07-10T10:00:44Z,"JP Morgan headquarters at Canary Wharf financial district at the heart of Canary Wharf financial ... [+] district on 7th May 2024 in London, United Kingdom. (photo by Mike Kemp/In Pictures via Getty … [+4198 chars]"
"{'id': None, 'name': 'ETF Daily News'}",MarketBeat News,Microsoft Co. (NASDAQ:MSFT) is CRA Financial Services LLC’s 6th Largest Position,"CRA Financial Services LLC lowered its stake in shares of Microsoft Co. (NASDAQ:MSFT – Free Report) by 0.7% during the first quarter, according to its most recent disclosure with the Securities and Exchange Commission. The firm owned 40,598 shares of the soft…",https://www.etfdailynews.com/2024/07/10/microsoft-co-nasdaqmsft-is-cra-financial-services-llcs-6th-largest-position/,https://www.americanbankingnews.com/wp-content/timthumb/timthumb.php?src=https://www.marketbeat.com/logos/microsoft-corporation-logo-1200x675.png&w=240&h=240&zc=2,2024-07-10T09:42:45Z,"CRA Financial Services LLC lowered its stake in shares of Microsoft Co. (NASDAQ:MSFT – Free Report) by 0.7% during the first quarter, according to its most recent disclosure with the Securities and E… [+6727 chars]"
"{'id': None, 'name': 'ETF Daily News'}",MarketBeat News,Microsoft Co. (NASDAQ:MSFT) Shares Sold by Symphony Financial Ltd. Co.,"Symphony Financial Ltd. Co. cut its holdings in shares of Microsoft Co. (NASDAQ:MSFT – Free Report) by 14.8% during the 1st quarter, according to its most recent Form 13F filing with the Securities and Exchange Commission. The firm owned 35,559 shares of the …",https://www.etfdailynews.com/2024/07/10/microsoft-co-nasdaqmsft-shares-sold-by-symphony-financial-ltd-co/,https://www.americanbankingnews.com/wp-content/timthumb/timthumb.php?src=https://www.marketbeat.com/logos/microsoft-corporation-logo-1200x675.png&w=240&h=240&zc=2,2024-07-10T09:42:45Z,"Symphony Financial Ltd. Co. cut its holdings in shares of Microsoft Co. (NASDAQ:MSFT – Free Report) by 14.8% during the 1st quarter, according to its most recent Form 13F filing with the Securities a… [+6969 chars]"
"{'id': None, 'name': 'ETF Daily News'}",MarketBeat News,Legend Financial Advisors Inc. Purchases 83 Shares of Microsoft Co. (NASDAQ:MSFT),"Legend Financial Advisors Inc. raised its position in shares of Microsoft Co. (NASDAQ:MSFT – Free Report) by 24.1% during the 1st quarter, according to its most recent disclosure with the Securities and Exchange Commission (SEC). The institutional investor ow…",https://www.etfdailynews.com/2024/07/10/legend-financial-advisors-inc-purchases-83-shares-of-microsoft-co-nasdaqmsft/,https://www.americanbankingnews.com/wp-content/timthumb/timthumb.php?src=https://www.marketbeat.com/logos/microsoft-corporation-logo-1200x675.png&w=240&h=240&zc=2,2024-07-10T09:42:45Z,"Legend Financial Advisors Inc. raised its position in shares of Microsoft Co. (NASDAQ:MSFT – Free Report) by 24.1% during the 1st quarter, according to its most recent disclosure with the Securities … [+6578 chars]"
"{'id': None, 'name': 'ETF Daily News'}",MarketBeat News,Microsoft Co. (NASDAQ:MSFT) Shares Sold by Town & Country Bank & Trust CO dba First Bankers Trust CO,"Town & Country Bank & Trust CO dba First Bankers Trust CO cut its holdings in Microsoft Co. (NASDAQ:MSFT – Free Report) by 1.2% during the 1st quarter, Holdings Channel reports. The firm owned 27,740 shares of the software giant’s stock after selling 331 shar…",https://www.etfdailynews.com/2024/07/10/microsoft-co-nasdaqmsft-shares-sold-by-town-country-bank-trust-co-dba-first-bankers-trust-co/,https://www.americanbankingnews.com/wp-content/timthumb/timthumb.php?src=https://www.marketbeat.com/logos/microsoft-corporation-logo-1200x675.png&w=240&h=240&zc=2,2024-07-10T09:42:45Z,"Town &amp; Country Bank &amp; Trust CO dba First Bankers Trust CO cut its holdings in Microsoft Co. (NASDAQ:MSFT – Free Report) by 1.2% during the 1st quarter, Holdings Channel reports. The firm owne… [+6670 chars]"
"{'id': None, 'name': 'ETF Daily News'}",MarketBeat News,Microsoft Co. (NASDAQ:MSFT) Holdings Raised by New Mexico Educational Retirement Board,"New Mexico Educational Retirement Board raised its stake in shares of Microsoft Co. (NASDAQ:MSFT – Free Report) by 12.7% in the first quarter, HoldingsChannel.com reports. The institutional investor owned 435,947 shares of the software giant’s stock after acq…",https://www.etfdailynews.com/2024/07/10/microsoft-co-nasdaqmsft-holdings-raised-by-new-mexico-educational-retirement-board/,https://www.americanbankingnews.com/wp-content/timthumb/timthumb.php?src=https://www.marketbeat.com/logos/microsoft-corporation-logo-1200x675.png&w=240&h=240&zc=2,2024-07-10T09:08:45Z,"New Mexico Educational Retirement Board raised its stake in shares of Microsoft Co. (NASDAQ:MSFT – Free Report) by 12.7% in the first quarter, HoldingsChannel.com reports. The institutional investor … [+6613 chars]"
"{'id': None, 'name': 'ETF Daily News'}",MarketBeat News,MPS Loria Financial Planners LLC Has $2.93 Million Stock Holdings in Microsoft Co. (NASDAQ:MSFT),"MPS Loria Financial Planners LLC lowered its stake in shares of Microsoft Co. (NASDAQ:MSFT – Free Report) by 6.2% during the 1st quarter, according to its most recent Form 13F filing with the Securities and Exchange Commission. The firm owned 6,964 shares of …",https://www.etfdailynews.com/2024/07/10/mps-loria-financial-planners-llc-has-2-93-million-stock-holdings-in-microsoft-co-nasdaqmsft/,https://www.americanbankingnews.com/wp-content/timthumb/timthumb.php?src=https://www.marketbeat.com/logos/microsoft-corporation-logo-1200x675.png&w=240&h=240&zc=2,2024-07-10T09:08:44Z,"MPS Loria Financial Planners LLC lowered its stake in shares of Microsoft Co. (NASDAQ:MSFT – Free Report) by 6.2% during the 1st quarter, according to its most recent Form 13F filing with the Securit… [+7010 chars]"
