source,author,title,description,url,urlToImage,publishedAt,content
"{'id': None, 'name': 'ETF Daily News'}",MarketBeat News,Microsoft Co. (NASDAQ:MSFT) is Norway Savings Bank’s 4th Largest Position,"Norway Savings Bank reduced its position in Microsoft Co. (NASDAQ:MSFT – Free Report) by 1.5% during the 1st quarter, according to its most recent filing with the Securities and Exchange Commission (SEC). The institutional investor owned 15,445 shares of the …",https://www.etfdailynews.com/2024/07/08/microsoft-co-nasdaqmsft-is-norway-savings-banks-4th-largest-position/,https://www.americanbankingnews.com/wp-content/timthumb/timthumb.php?src=https://www.marketbeat.com/logos/microsoft-corporation-logo-1200x675.png&w=240&h=240&zc=2,2024-07-08T09:38:43Z,"Norway Savings Bank reduced its position in Microsoft Co. (NASDAQ:MSFT – Free Report) by 1.5% during the 1st quarter, according to its most recent filing with the Securities and Exchange Commission (… [+6528 chars]"
"{'id': None, 'name': 'ETF Daily News'}",MarketBeat News,Microsoft Co. (NASDAQ:MSFT) Position Trimmed by Webster Bank N. A.,"Webster Bank N. A. reduced its position in shares of Microsoft Co. (NASDAQ:MSFT – Free Report) by 1.6% in the 1st quarter, according to the company in its most recent 13F filing with the Securities and Exchange Commission. The institutional investor owned 70,…",https://www.etfdailynews.com/2024/07/08/microsoft-co-nasdaqmsft-position-trimmed-by-webster-bank-n-a/,https://www.americanbankingnews.com/wp-content/timthumb/timthumb.php?src=https://www.marketbeat.com/logos/microsoft-corporation-logo-1200x675.png&w=240&h=240&zc=2,2024-07-08T09:38:43Z,"Webster Bank N. A. reduced its position in shares of Microsoft Co. (NASDAQ:MSFT – Free Report) by 1.6% in the 1st quarter, according to the company in its most recent 13F filing with the Securities a… [+6878 chars]"
"{'id': None, 'name': 'ETF Daily News'}",MarketBeat News,"S.E.E.D. Planning Group LLC Sells 1,595 Shares of Microsoft Co. (NASDAQ:MSFT)","S.E.E.D. Planning Group LLC decreased its holdings in shares of Microsoft Co. (NASDAQ:MSFT – Free Report) by 6.1% in the 1st quarter, according to the company in its most recent Form 13F filing with the Securities & Exchange Commission. The fund owned 24,518 …",https://www.etfdailynews.com/2024/07/08/s-e-e-d-planning-group-llc-sells-1595-shares-of-microsoft-co-nasdaqmsft/,https://www.americanbankingnews.com/wp-content/timthumb/timthumb.php?src=https://www.marketbeat.com/logos/microsoft-corporation-logo-1200x675.png&w=240&h=240&zc=2,2024-07-08T09:38:43Z,"S.E.E.D. Planning Group LLC decreased its holdings in shares of Microsoft Co. (NASDAQ:MSFT – Free Report) by 6.1% in the 1st quarter, according to the company in its most recent Form 13F filing with … [+6395 chars]"
"{'id': None, 'name': 'ETF Daily News'}",MarketBeat News,Total Investment Management Inc. Grows Stock Holdings in Microsoft Co. (NASDAQ:MSFT),"Total Investment Management Inc. raised its stake in shares of Microsoft Co. (NASDAQ:MSFT – Free Report) by 17.2% in the 1st quarter, Holdings Channel reports. The fund owned 3,013 shares of the software giant’s stock after acquiring an additional 443 shares …",https://www.etfdailynews.com/2024/07/08/total-investment-management-inc-grows-stock-holdings-in-microsoft-co-nasdaqmsft/,https://www.americanbankingnews.com/wp-content/timthumb/timthumb.php?src=https://www.marketbeat.com/logos/microsoft-corporation-logo-1200x675.png&w=240&h=240&zc=2,2024-07-08T09:38:42Z,"Total Investment Management Inc. raised its stake in shares of Microsoft Co. (NASDAQ:MSFT – Free Report) by 17.2% in the 1st quarter, Holdings Channel reports. The fund owned 3,013 shares of the soft… [+7101 chars]"
"{'id': None, 'name': 'ETF Daily News'}",MarketBeat News,"Kathmere Capital Management LLC Acquires 4,279 Shares of Microsoft Co. (NASDAQ:MSFT)","Kathmere Capital Management LLC grew its holdings in Microsoft Co. (NASDAQ:MSFT – Free Report) by 27.6% in the 1st quarter, according to the company in its most recent filing with the SEC. The firm owned 19,774 shares of the software giant’s stock after buyin…",https://www.etfdailynews.com/2024/07/08/kathmere-capital-management-llc-acquires-4279-shares-of-microsoft-co-nasdaqmsft/,https://www.americanbankingnews.com/wp-content/timthumb/timthumb.php?src=https://www.marketbeat.com/logos/microsoft-corporation-logo-1200x675.png&w=240&h=240&zc=2,2024-07-08T09:38:42Z,"Kathmere Capital Management LLC grew its holdings in Microsoft Co. (NASDAQ:MSFT – Free Report) by 27.6% in the 1st quarter, according to the company in its most recent filing with the SEC. The firm o… [+6408 chars]"
"{'id': None, 'name': 'ETF Daily News'}",MarketBeat News,OneAscent Wealth Management LLC Sells 198 Shares of Microsoft Co. (NASDAQ:MSFT),"OneAscent Wealth Management LLC reduced its position in shares of Microsoft Co. (NASDAQ:MSFT – Free Report) by 4.0% in the first quarter, according to its most recent filing with the SEC. The fund owned 4,712 shares of the software giant’s stock after selling…",https://www.etfdailynews.com/2024/07/08/oneascent-wealth-management-llc-sells-198-shares-of-microsoft-co-nasdaqmsft/,https://www.americanbankingnews.com/wp-content/timthumb/timthumb.php?src=https://www.marketbeat.com/logos/microsoft-corporation-logo-1200x675.png&w=240&h=240&zc=2,2024-07-08T09:38:42Z,"OneAscent Wealth Management LLC reduced its position in shares of Microsoft Co. (NASDAQ:MSFT – Free Report) by 4.0% in the first quarter, according to its most recent filing with the SEC. The fund ow… [+7063 chars]"
"{'id': None, 'name': 'ETF Daily News'}",MarketBeat News,Microsoft Co. (NASDAQ:MSFT) Stock Holdings Increased by Silverleafe Capital Partners LLC,"Silverleafe Capital Partners LLC raised its holdings in shares of Microsoft Co. (NASDAQ:MSFT – Free Report) by 3.0% in the first quarter, according to its most recent Form 13F filing with the SEC. The institutional investor owned 7,157 shares of the software …",https://www.etfdailynews.com/2024/07/08/microsoft-co-nasdaqmsft-stock-holdings-increased-by-silverleafe-capital-partners-llc/,https://www.americanbankingnews.com/wp-content/timthumb/timthumb.php?src=https://www.marketbeat.com/logos/microsoft-corporation-logo-1200x675.png&w=240&h=240&zc=2,2024-07-08T09:38:42Z,"Silverleafe Capital Partners LLC raised its holdings in shares of Microsoft Co. (NASDAQ:MSFT – Free Report) by 3.0% in the first quarter, according to its most recent Form 13F filing with the SEC. Th… [+6799 chars]"
"{'id': None, 'name': 'ETF Daily News'}",MarketBeat News,Microsoft Co. (NASDAQ:MSFT) is Weaver Consulting Group’s 9th Largest Position,"Weaver Consulting Group reduced its position in shares of Microsoft Co. (NASDAQ:MSFT – Free Report) by 0.3% during the 1st quarter, according to the company in its most recent 13F filing with the Securities & Exchange Commission. The institutional investor ow…",https://www.etfdailynews.com/2024/07/08/microsoft-co-nasdaqmsft-is-weaver-consulting-groups-9th-largest-position/,https://www.americanbankingnews.com/wp-content/timthumb/timthumb.php?src=https://www.marketbeat.com/logos/microsoft-corporation-logo-1200x675.png&w=240&h=240&zc=2,2024-07-08T09:06:50Z,"Weaver Consulting Group reduced its position in shares of Microsoft Co. (NASDAQ:MSFT – Free Report) by 0.3% during the 1st quarter, according to the company in its most recent 13F filing with the Sec… [+7131 chars]"
"{'id': None, 'name': 'ETF Daily News'}",MarketBeat News,Microsoft Co. (NASDAQ:MSFT) is Stillwater Capital Advisors LLC’s 2nd Largest Position,"Stillwater Capital Advisors LLC trimmed its position in shares of Microsoft Co. (NASDAQ:MSFT – Free Report) by 1.1% in the 1st quarter, according to the company in its most recent Form 13F filing with the Securities and Exchange Commission. The fund owned 118…",https://www.etfdailynews.com/2024/07/08/microsoft-co-nasdaqmsft-is-stillwater-capital-advisors-llcs-2nd-largest-position/,https://www.americanbankingnews.com/wp-content/timthumb/timthumb.php?src=https://www.marketbeat.com/logos/microsoft-corporation-logo-1200x675.png&w=240&h=240&zc=2,2024-07-08T08:34:45Z,"Stillwater Capital Advisors LLC trimmed its position in shares of Microsoft Co. (NASDAQ:MSFT – Free Report) by 1.1% in the 1st quarter, according to the company in its most recent Form 13F filing wit… [+6623 chars]"
